{"document_type":"readiness_context","schema_version":"1.1","subject":{"repository":"syuhei0519/platform-gitops","pr_number":58,"head_sha":"e01882d8a2c4ac4eadad5b081c1b5c69e5599776","base_sha":"b989e29b8addbd6396c5c2b4833b969bc15fc8fa","target_revision":"e01882d8a2c4ac4eadad5b081c1b5c69e5599776","config_revision":"sha256:3ba80361940bcb0423db220d3fbc13ec1c0acb791e10b71d3327e160936fc969","merge_group_sha":null},"issue_id":"backend-app#2","acceptance_criteria":[{"id":"AC-1","verbatim":"作成したOrderが再起動後も取得できる","source":"https://github.com/syuhei0519/backend-app/issues/2","verification_phase":"premerge"},{"id":"AC-2","verbatim":"不正入力は4xxとなりAccount CRUDが維持される","source":"https://github.com/syuhei0519/backend-app/issues/2","verification_phase":"premerge"},{"id":"AC-3","verbatim":"独立ServiceがSyncedかつHealthyになり対応image digestが確認できる","source":"https://github.com/syuhei0519/backend-app/issues/2","verification_phase":"premerge"}],"pr_ac_ids":[],"deployment_effect":"none","policy_observed_at":"2026-10-11T17:37:33Z","policy_valid_until":"2026-10-11T18:22:33Z","policy_evidence":"Manager GET PR58/head/base, main summary, parent-inclusive rulesets and active24733421, reviews/comments and exact-head checks. Strict ci-result successful; zero approvals/no queue/no bypass. Input classification only; independent Test/Review and operation-time refresh pending.","github_requirements":{"checks":true,"reviews":true,"queue":false},"issue_integration_scope":"aggregate_required","pr_kind":"preparation","preparation":{"scope_reason":"P0 is explicitly disabled GitOps/observer preparation in the original Research plan. Existing three registered Applications and default/local desired resources must remain unchanged; no real Order activation or product acceptance is claimed.","related_ac_ids":["AC-3"],"conditions":[{"id":"P0-S1","verbatim":"orderEnabled=false既定で、新Order関連Applicationを生成しない。既存3Application/namespace/AppProject/既存Account main追跡とdefault/local renderを不変に保つ。","method":"Compare all root/platform/workload default/local renders and existing namespace/AppProject/Account reference bytes against base.","expected_result":"No new active resources; existing renders and Account main tracking unchanged."},{"id":"P0-S2","verbatim":"将来有効化時のOrder専用40桁Manifest revisionと独立DB→OrderのApplication定義を用意し、欠落/浮動revision/不正値をfail-closedに検証する。trueは合成render fixtureだけで、live valuesはfalse。","method":"Execute schema and render normal/invalid inputs, enabled-only fixed40hex revision, DB/Order names and sync order, existingscopeunchanged.","expected_result":"Only valid synthetic enabled data renders fixed-source Order Applications; all unsafe/missing/floating values rejected."},{"id":"P0-S3","verbatim":"bootstrap observerのleaf/hook対象をoptionalに拡張し、disabledでは既存3Appだけ、enabledではOrder DB/Orderの欠落・進行・失敗・revision/health/migration状態を正しく扱う。未知状態を成功化せず、既存observer動作を回帰検証する。","method":"Execute observer state-machine positive/negative tests including missing/failed/unknown/revision drift/migration hook and three-leaf default regressions.","expected_result":"Only complete correct bounded observations succeed; missing/failed/unknown cannot become success and old behavior remains compatible except explicitly safe unknown-state rejection."},{"id":"P0-S4","verbatim":"全既存関連testsと新schema/render/observer正常異常境界試験を実行し、設定とドキュメント整合、デプロイ影響noneの根拠、P1/T6/T7と必要承認/環境/失敗対応を引き渡す。","method":"Run all related existing tests and independent adversarial fixtures; reconcile fixed docs/dependencies/evidence/limits.","expected_result":"All required preparation checks pass with original evidence, no fabricated actualService/digest/T6/T7 or productmet."}],"artifacts":[{"id":"order-applications","locator":"artifacts/order-applications","revision":"e01882d8a2c4ac4eadad5b081c1b5c69e5599776","sha256":"de513a9849e81ea479076027461d0542aea4104b75fe4db39988aadb4fffbcfd","size_bytes":1274},{"id":"workloads-schema","locator":"artifacts/workloads-schema","revision":"e01882d8a2c4ac4eadad5b081c1b5c69e5599776","sha256":"24c6cf3632e199a1c7b4b3cdfe93798741fd4ac11839d8bfbd4cba32b1f62e3c","size_bytes":864},{"id":"bootstrap-observer","locator":"artifacts/bootstrap-observer","revision":"e01882d8a2c4ac4eadad5b081c1b5c69e5599776","sha256":"9f5bd6f950d0bf5fa4c11939b1c205826511b3e81bb36b33526e789476682af2","size_bytes":6662}],"followup":[{"ac_id":"AC-3","owner":"Manager coordinates M2/P1; independent Test measures real Argo/runtime acceptance.","environment":"Approved isolated kind first, then actual target only with Deployment Ready and required owner/environment approval.","method":"Use genuine B2 image digest, merged M2 revision and fixed P1 candidate, check migration/DB/Service/ArgoSyncedHealthy/runtimeimageID and AccountOrder regressions, then repeat final integrated main state.","dependencies":["B2 actual Order release","M1 disabled charts and M2 realdigest selection","P1 fixed final Manifestrevision","Authorized kind/context/Secret/PVC/rollback readiness","T7 final integrated measurement"],"failure_action":"Stop affected merge/enable/deploy, retain Account data and OrderPVC, record safe failure evidence, forward-fix and independently retest."}],"product_outcomes":[{"ac_id":"AC-1","outcome":"unverified"},{"ac_id":"AC-2","outcome":"unverified"},{"ac_id":"AC-3","outcome":"unverified"}]}}
